{
    "$schema": "https://json-schema.org/draft/2020-12/schema",
    "title": "GeoBlacklight Schema - Aardvark",
    "description": "Schema for GeoBlacklight. See https://opengeometadata.github.io/aardvark/aardvarkMetadata.html for more details.",
    "type": "object",
    "properties": {
        "dct_title_s": {
            "$anchor": "dc_title_s",
            "type": "string"
        },
        "dct_alternative_sm": {
            "$anchor": "dct_alternative_sm",
            "type": "array",
            "items": {
                "type": "string"
            }
        },
        "dct_description_sm": {
            "$anchor": "dct_description_sm",
            "type": "array",
            "items": {
                "type": "string"
            }
        },
        "dct_language_sm": {
            "$anchor": "dct_language_sm",
            "type": "array",
            "items": {
                "type": "string"
            }
        },
        "gbl_displayNote_sm": {
            "$anchor": "gbl_displayNote_sm",
            "type": "array",
            "items": {
                "type": "string"
            }
        },
        "dct_creator_sm": {
            "$anchor": "dct_creator_sm",
            "type": "array",
            "items": {
                "type": "string"
            }
        },
        "dct_publisher_sm": {
            "$anchor": "dct_publisher_sm",
            "type": "array",
            "items": {
                "type": "string"
            }
        },
        "schema_provider_s": {
            "$anchor": "schema_provider_s",
            "type": "string"
        },
        "gbl_resourceClass_sm": {
            "$anchor": "gbl_resourceClass_sm",
            "type": "array",
            "items": {
                "type": "string",
                "enum": [
                    "Datasets",
                    "Maps",
                    "Imagery",
                    "Collections",
                    "Websites",
                    "Web services",
                    "Other"
                ]
            }
        },
        "gbl_resourceType_sm": {
            "$anchor": "gbl_resourceType_sm",
            "type": "array",
            "items": {
                "type": "string"
            }
        },
        "dct_subject_sm": {
            "$anchor": "dct_subject_sm",
            "type": "array",
            "items": {
                "type": "string"
            }
        },
        "dcat_theme_sm": {
            "$anchor": "dcat_theme_sm",
            "type": "array",
            "items": {
                "type": "string"
            }
        },
        "dcat_keyword_sm": {
            "$anchor": "dcat_keyword_sm",
            "type": "array",
            "items": {
                "type": "string"
            }
        },
        "dct_temporal_sm": {
            "$anchor": "dct_temporal_sm",
            "type": "array",
            "items": {
                "type": "string"
            }
        },
        "dct_issued_s": {
            "$anchor": "dct_issued_s",
            "type": "string"
        },
        "gbl_indexYear_im": {
            "$anchor": "gbl_indexYear_im",
            "type": "array",
            "items": {
                "type": "integer"
            }
        },
        "gbl_dateRange_drsim": {
            "$anchor": "gbl_dateRange_drsim",
            "type": "array",
            "items": {
                "type": "string"
            }
        },
        "dct_spatial_sm": {
            "$anchor": "dct_spatial_sm",
            "type": "array",
            "items": {
                "type": "string"
            }
        },
        "locn_geometry": {
            "$anchor": "locn_geometry",
            "type": "string"
        },
        "dcat_bbox": {
            "$anchor": "dcat_bbox",
            "type": "string"
        },
        "dcat_centroid": {
            "$anchor": "dcat_centroid",
            "type": "string"
        },
        "dct_relation_sm": {
            "$anchor": "dct_relation_sm",
            "type": "array",
            "items": {
                "type": "string"
            }
        },
        "pcdm_memberOf_sm": {
            "$anchor": "pcdm_memberOf_sm",
            "type": "array",
            "items": {
                "type": "string"
            }
        },
        "dct_isPartOf_sm": {
            "$anchor": "dct_isPartOf_sm",
            "type": "array",
            "items": {
                "type": "string"
            }
        },
        "dct_source_sm": {
            "$anchor": "dct_source_sm",
            "type": "array",
            "items": {
                "type": "string"
            }
        },
        "dct_isVersionOf_sm": {
            "$anchor": "dct_isVersionOf_sm",
            "type": "array",
            "items": {
                "type": "string"
            }
        },
        "dct_replaces_sm": {
            "$anchor": "dct_replaces_sm",
            "type": "array",
            "items": {
                "type": "string"
            }
        },
        "dct_isReplacedBy_sm": {
            "$anchor": "dct_isReplacedBy_sm",
            "type": "array",
            "items": {
                "type": "string"
            }
        },
        "dct_rights_sm": {
            "$anchor": "dct_rights_sm",
            "type": "array",
            "items": {
                "type": "string"
            }
        },
        "dct_rightsHolder_sm": {
            "$anchor": "dct_rightsHolder_sm",
            "type": "array",
            "items": {
                "type": "string"
            }
        },
        "dct_license_sm": {
            "$anchor": "dct_license_sm",
            "type": "array",
            "items": {
                "type": "string"
            }
        },
        "dct_accessRights_s": {
            "$anchor": "dct_accessRights_s",
            "type": "string"
        },
        "dct_format_s": {
            "$anchor": "dct_format_s",
            "type": "string"
        },
        "gbl_fileSize_s": {
            "$anchor": "gbl_fileSize_s",
            "type": "string"
        },
        "gbl_wxsIdentifier_s": {
            "$anchor": "gbl_wxsIdentifier_s",
            "type": "string"
        },
        "dct_references_s": {
            "$anchor": "dct_references_s",
            "type": "string"
        },
        "id": {
            "$anchor": "id",
            "type": "string"
        },
        "dct_identifier_sm": {
            "$anchor": "dct_identifier_sm",
            "type": "array",
            "items": {
                "type": "string"
            }
        },
        "gbl_mdModified_dt": {
            "$anchor": "gbl_mdModified_dt",
            "type": "string",
            "format": "date-time"
        },
        "gbl_mdVersion_s": {
            "$anchor": "gbl_mdVersion_s",
            "type": "string",
            "const": "Aardvark"
        },
        "gbl_suppressed_b": {
            "$anchor": "gbl_suppressed_b",
            "type": "boolean"
        },
        "gbl_georeferenced_b": {
            "$anchor": "gbl_georeferenced_b",
            "type": "boolean"
        }
    },
    "required": [
        "id",
        "dct_title_s",
        "gbl_resourceClass_sm",
        "dct_accessRights_s",
        "gbl_mdVersion_s"
    ]
}