{
  "dct_accessRights_s": "Restricted",
  "dct_title_s": "Egypt, Cairo (Topographic Map, 1972)",
  "gbl_mdModified_dt": "2024-02-08T21:28:41+00:00",
  "gbl_mdVersion_s": "Aardvark",
  "gbl_resourceClass_sm": [
    "Imagery"
  ],
  "id": "mit:EG_CAIRO_A25TOPO_1972",
  "dcat_bbox": "ENVELOPE(31.161907, 31.381609, 30.141311, 29.994131)",
  "dct_references_s": "{\"http://schema.org/downloadUrl\": [{\"label\": \"Source Metadata\", \"url\": \"https://cdn.dev1.mitlibrary.net/geo/public/EG_CAIRO_A25TOPO_1972.source.fgdc.xml\"}, {\"label\": \"Aardvark Metadata\", \"url\": \"https://cdn.dev1.mitlibrary.net/geo/public/EG_CAIRO_A25TOPO_1972.normalized.aardvark.json\"}, {\"label\": \"Data\", \"url\": \"https://cdn.dev1.mitlibrary.net/geo/restricted/EG_CAIRO_A25TOPO_1972.zip\"}], \"http://schema.org/url\": \"https://geodata.libraries.mit.edu/record/gismit:EG_CAIRO_A25TOPO_1972\"}",
  "locn_geometry": "ENVELOPE(31.161907, 31.381609, 30.141311, 29.994131)",
  "dcat_theme_sm": [
    "Elevation"
  ],
  "dct_creator_sm": [
    "Soviet Union. Sovetskaia Armiia. Generalnyi Shtab (Soviet)"
  ],
  "dct_description_sm": [
    "This layer is a georeferenced raster image of a paper map entitled Cairo (H-36-63, 75). The original scanned image with the legend and other information regarding the source is available in Dome. See the online linkage."
  ],
  "dct_format_s": "Raster",
  "dct_identifier_sm": [
    "EG_CAIRO_A25TOPO_1972",
    "http://hdl.handle.net/1721.3/172443",
    "EG_CAIRO_A25TOPO_1972.tif"
  ],
  "dct_issued_s": "1972-01-01",
  "dct_language_sm": [
    "eng"
  ],
  "dct_publisher_sm": [
    "LAND INFO Worldwide Mapping, LLC"
  ],
  "dct_rights_sm": [
    "All data is the copyrighted property of LAND INFO Worldwide Mapping, LLC and/or its suppliers. Land Info grants customer unlimited, perpetual license for academic use of data and license to distribute data on a non-commercial basis, or as Derived Works. Derived works that include the source data must be merged with other value-added data in such a way that the derived work can\u2019t be converted back to the original source data format. Other Derived Works that don\u2019t include the source data (vector extraction, classification etc.) have no restrictions on use and distribution. An unlimited license is granted for media use, provided that the following citation is used: \"map data courtesy www.landinfo.com.\""
  ],
  "dct_spatial_sm": [
    "Egypt",
    "Cairo"
  ],
  "dct_subject_sm": [
    "maps",
    "topographic maps",
    "raster",
    "land use",
    "imageryBaseMapsEarthCover",
    "elevation"
  ],
  "dct_temporal_sm": [
    "1972-01-01"
  ],
  "gbl_indexYear_im": [
    1972
  ],
  "gbl_suppressed_b": false,
  "schema_provider_s": "GIS Lab, MIT Libraries",
  "dcat_keyword_sm": ["fish","snails"],
  "dct_alternative_sm": ["This is another title"],
  "gbl_dateRange_drsim": ["[1990 TO 1991]"],
  "gbl_resourceType_sm": ["Raster data"]
}